<TcMenuPlugin name="DEPRECATED Framebuffer on mbed for STM (see newer plugin)"
              id="fc7b8f22-6553-43d6-9968-df4ee2562aaf" subsystem="DISPLAY"
              requiresDesigner="2.0" needsTheme="color[tcUnicode]"
              xmlns="https://www.thecoderscorner.com/libraries/tcmenuPluginItem" xmlns:xsi="http://www.w3.org/2001/XMLSchema-instance"
              xsi:schemaLocation="https://www.thecoderscorner.com/libraries/tcmenuPluginItem https://tcmenu.github.io/documentation/arduino-libraries/libraries/tcmenu-plugin-item.xsd">
    <SupportedPlatforms>
        <Platform>MBED_RTOS</Platform>
        <Platform>STM32DUINO</Platform>
    </SupportedPlatforms>
    <Description>Legacy only for mbed, framebuffer driver for STM32 using BSP functions</Description>
    <Documentation link="https://tcmenu.github.io/documentation/arduino-libraries/tc-menu/tcmenu-plugins/mbed-stm32-menu-touch-display/"/>
    <RequiredLibraries/>
    <ImageFile>adagfx-color.jpg</ImageFile>

    <Properties>
        <Property id="DISPLAY_WIDTH" name="%core.display.width" initial="240" desc="%core.display.width.desc" type="int" min="1" max="10000"/>
        <Property id="DISPLAY_HEIGHT" name="%core.display.height" initial="320" desc="%core.display.height.desc" type="int" min="1" max="10000"/>
        <Property id="UPDATES_PER_SEC" name="%core.screen.updates.sec" initial="10" desc="%core.screen.updates.sec.desc" type="int" min="1" max="10"/>

        <Property id="TOUCH_SEPARATOR" name="%core.touch.separator" initial="" desc="%core.touch.separator.desc" type="separator"/>
        <Property id="TOUCH_SCREEN_REQUIRED" name="%core.touch.required" initial="true" desc="%core.touch.required.desc" type="boolean" />

        <Property id="ORIENTATION_SEPARATOR" name="%core.touch.orientation" initial="" desc="%core.touch.orientation.desc" type="separator"/>
        <Property id="TFT_TOUCH_SWAP_XY" name="%core.touch.swap.xy" initial="false" whenProperty="TOUCH_SCREEN_REQUIRED" isValue="true"
                  desc="%core.touch.swap.xy.desc" type="boolean" />
        <Property id="TFT_TOUCH_X_INVERTED" name="%core.touch.x.inverted" initial="false" whenProperty="TOUCH_SCREEN_REQUIRED" isValue="true"
                  type="boolean" desc="%core.touch.x.inverted.desc"/>
        <Property id="TFT_TOUCH_Y_INVERTED" name="%core.touch.y.inverted" initial="false" whenProperty="TOUCH_SCREEN_REQUIRED" isValue="true"
                  type="boolean" desc="%core.touch.y.inverted.desc"/>

        <Property id="CALIB_SEPARATOR" name="%core.touch.calibration" initial="" desc="%core.touch.calibration.desc" type="separator"/>
        <Property id="TOUCH_SCREEN_CALIBRATE" name="%core.enable.touch.calib" initial="true"
                  desc="%core.enable.touch.calib.desc" type="boolean" whenProperty="TOUCH_SCREEN_REQUIRED" isValue="true"  />
        <Property id="TOUCH_CALIBRATION_STORAGE_LOC" name="%core.touch.calib.addr" initial="400" type="int"
                  desc="%core.touch.calib.addr.desc"  min="4" max="65535" whenProperty="TOUCH_SCREEN_REQUIRED" isValue="true" />
    </Properties>

    <ApplicabilityDefs>
        <ApplicabilityDef key="touchCalibrationNeeded" mode="and">
            <Applicability whenProperty="TOUCH_SCREEN_REQUIRED" isValue="true"/>
            <Applicability whenProperty="TOUCH_SCREEN_CALIBRATE" isValue="true"/>
        </ApplicabilityDef>
    </ApplicabilityDefs>
    <SourceFiles>
        <Replacement find="define TC_BSP_TOUCH_DEVICE_PRESENT true" replace="define TC_BSP_TOUCH_DEVICE_PRESENT ${TOUCH_SCREEN_REQUIRED}"/>
        <Replacement find="BspUserSettings\\.h" replace="${SRC_DIR_OFFSET}BspUserSettings.h"/>
        <SourceFile name="mbedStm32Bsp/BspUserSettings.h" overwrite="false"/>
        <SourceFile name="mbedStm32Bsp/tcMenuStChromaArt.h" />
        <SourceFile name="mbedStm32Bsp/tcMenuStChromaArt.cpp" />
    </SourceFiles>

    <IncludeFiles>
        <Header name="${SRC_DIR_OFFSET}BspUserSettings.h" inSource="true"/>
        <Header name="tcMenuStChromaArt.h" inSource="true"/>
        <Header name="graphics/MenuTouchScreenEncoder.h" inSource="false"/>
        <Header name="extras/DrawableTouchCalibrator.h" inSource="false" applicabilityRef="touchCalibrationNeeded"/>
    </IncludeFiles>

    <GlobalVariables>
        <Variable name="${DISPLAY_VARIABLE}Drawable" type="StChromaArtDrawable" export="true"/>

        <Variable name="renderer" type="GraphicsDeviceRenderer" export="true">
            <Param value="30"/>
            <Param value="applicationInfo.name"/>
            <Param ref="${DISPLAY_VARIABLE}Drawable"/>
        </Variable>

        <Variable name="touchInterrogator" type="StBspTouchInterrogator" export="true" whenProperty="TOUCH_SCREEN_REQUIRED" isValue="true">
            <Param value="${DISPLAY_WIDTH}"/>
            <Param value="${DISPLAY_HEIGHT}"/>
        </Variable>

        <Variable name="touchOrientation" type="iotouch::TouchOrientationSettings" export="false" whenProperty="TOUCH_SCREEN_REQUIRED" isValue="true">
            <Param value="${TFT_TOUCH_SWAP_XY}"/>
            <Param value="${TFT_TOUCH_X_INVERTED}"/>
            <Param value="${TFT_TOUCH_Y_INVERTED}"/>
        </Variable>

        <Variable name="touchScreen" type="MenuTouchScreenManager" export="true" whenProperty="TOUCH_SCREEN_REQUIRED" isValue="true">
            <Param ref="touchInterrogator"/>
            <Param ref="renderer"/>
            <Param value="touchOrientation"/>
        </Variable>

        <Variable name="touchCalibrator" type="tcextras::IoaTouchScreenCalibrator" export="true" applicabilityRef="touchCalibrationNeeded">
            <Param ref="touchScreen"/>
            <Param ref="renderer"/>
            <Param value="${TOUCH_CALIBRATION_STORAGE_LOC}"/>
        </Variable>

    </GlobalVariables>

    <SetupFunctions>
        <Function object="renderer" name="setUpdatesPerSecond">
            <Param value="${UPDATES_PER_SEC}"/>
        </Function>

        <Function name="start" object="touchScreen" whenProperty="TOUCH_SCREEN_REQUIRED" isValue="true"/>
    </SetupFunctions>
</TcMenuPlugin>