<TcMenuPlugin name="DEPRECATED cool blue traditional" id="03c6b25f-db63-402a-8447-a5ce1484c14d"
              subsystem="THEME" requiresDesigner="2.0" needsTheme="color"
              xmlns="https://www.thecoderscorner.com/libraries/tcmenuPluginItem" xmlns:xsi="http://www.w3.org/2001/XMLSchema-instance"
              xsi:schemaLocation="https://www.thecoderscorner.com/libraries/tcmenuPluginItem https://www.thecoderscorner.com/arduino-libraries/libraries/tcmenu-plugin-item.xsd">
    <SupportedPlatforms>
       <All/>
    </SupportedPlatforms>
    <Description>THIS THEME IS DEPRECATED (kept for existing users), cool blue traditional theme</Description>
    <Documentation link="https://www.thecoderscorner.com/products/arduino-libraries/tc-menu/themes/color-themes-for-all-display-sizes/"/>
    <RequiredLibraries/>
    <ImageFile>theme-cool-blue-traditional.jpg</ImageFile>

    <Properties>
        <Property id="ITEM_FONT" name="%theme.item.font" initial="def:,1" desc="%theme.item.font.desc" type="font"/>
        <Property id="TITLE_FONT" name="%theme.title.font" initial="def:,1" desc="%theme.title.font.desc" type="font"/>
        <Property id="BORDER_FOR_ACTIONS" name="%theme.border.for.action" initial="0" desc="%theme.border.for.action.desc" type="int" min="0" max="3"/>
        <Property id="TITLE_SHOW_MODE" name="%theme.title.show.mode" initial="TITLE_FIRST_ROW" desc="%theme.title.show.mode.desc" type="choice">
            <Choices>
                <Choice desc="%theme.title.none">NO_TITLE</Choice>
                <Choice desc="%theme.title.first.row">TITLE_FIRST_ROW</Choice>
                <Choice desc="%theme.title.always">TITLE_ALWAYS</Choice>
            </Choices>
        </Property>
        <Property id="USE_TC_UNICODE" name="%theme.use.tcunicode" initial="false" type="boolean" desc="%theme.use.tcunicode.desc"/>
        <Property id="USE_SLIDER_ANALOG" name="%theme.use.sliders" initial="true" desc="%theme.use.sliders.desc" type="boolean"/>
        <Property id="NEED_EDITING_ICONS" name="%theme.need.edit.icons" initial="true" desc="theme.need.edit.icons.desc" type="boolean"/>
    </Properties>

    <ApplicabilityDefs/>

    <SourceFiles>
        <SourceFile name="coolBlue/ThemeCoolBlueTraditional.h" overwrite="false"/>
    </SourceFiles>

    <IncludeFiles>
        <Header name="${SRC_DIR_OFFSET}ThemeCoolBlueTraditional.h" inSource="cppSrc"/>
        <Header name="tcUnicodeHelper.h" inSource="false" priority="high" whenProperty="USE_TC_UNICODE" isValue="true" />
        <Header name="${ITEM_FONT}" inSource="font"/>
        <Header name="${TITLE_FONT}" inSource="font"/>
    </IncludeFiles>

    <GlobalVariables>
        <Variable name="${ITEM_FONT}" export="font" whenProperty="ITEM_FONT" matches="(ad[al]|tc[al]):.*" />
        <Variable name="${TITLE_FONT}" export="font" whenProperty="ITEM_FONT" matches="(ad[al]|tc[al]):.*" />
    </GlobalVariables>

    <SetupFunctions>
        <Function name="setTitleMode" object="renderer">
            <Param name="BaseGraphicalRenderer::${TITLE_SHOW_MODE}"/>
        </Function>

        <Function name="setUseSliderForAnalog" object="renderer">
            <Param name="${USE_SLIDER_ANALOG}"/>
        </Function>

        <Function name="enableTcUnicode" object="renderer" whenProperty="USE_TC_UNICODE" isValue="true"/>

        <Function name="installCoolBlueTraditionalTheme">
            <Param value="renderer"/>
            <Param font="${ITEM_FONT}"/>
            <Param font="${TITLE_FONT}"/>
            <Param value="${NEED_EDITING_ICONS}"/>
        </Function>
    </SetupFunctions>
</TcMenuPlugin>