<TcMenuPlugin name="%theme.mono.inverse.name" id="396ED4DF-AD7B-4951-A848-A9E5838A549B"
              subsystem="THEME" requiresDesigner="2.0" needsTheme="mono"
              xmlns="https://www.thecoderscorner.com/libraries/tcmenuPluginItem" xmlns:xsi="http://www.w3.org/2001/XMLSchema-instance"
              xsi:schemaLocation="https://www.thecoderscorner.com/libraries/tcmenuPluginItem https://www.thecoderscorner.com/arduino-libraries/libraries/tcmenu-plugin-item.xsd">
    <SupportedPlatforms>
       <All/>
    </SupportedPlatforms>
    <Description>%theme.mono.inverse.desc</Description>
    <Documentation link="https://www.thecoderscorner.com/products/arduino-libraries//tc-menu/themes/monochrome-themes-for-oled-5110/"/>
    <RequiredLibraries/>
    <ImageFile>theme-oled-inverse.jpg</ImageFile>

    <Properties>
        <Property id="ITEM_FONT" name="%theme.item.font" initial="def:,1" desc="%theme.item.font.desc" type="font"/>
        <Property id="TITLE_FONT" name="%theme.title.font" initial="def:,1" desc="%theme.title.font.desc" type="font"/>
        <Property id="TITLE_HEADER_PADDING" name="%theme.item.header.padding" initial="2" desc="%theme.item.header.padding.desc" type="int" min="0" max="10"/>
        <Property id="TITLE_TO_ITEM_SPACING" name="%theme.mono.spacing.title.item" initial="2" desc="The spacing between the title and the first item" type="int" min="0" max="10"/>
        <Property id="TITLE_SHOW_MODE" name="%theme.title.show.mode" initial="TITLE_FIRST_ROW" desc="%theme.title.show.mode.desc" type="choice">
            <Choices>
                <Choice desc="%theme.title.none">NO_TITLE</Choice>
                <Choice desc="%theme.title.first.row">TITLE_FIRST_ROW</Choice>
                <Choice desc="%theme.title.always">TITLE_ALWAYS</Choice>
            </Choices>
        </Property>
        <Property id="USE_TC_UNICODE" name="%theme.use.tcunicode" initial="false" type="boolean" desc="%theme.use.tcunicode.desc"/>
    </Properties>

    <ApplicabilityDefs/>

    <SourceFiles>
        <Replacement find="TITLE_SPACING 1" replace="TITLE_SPACING ${TITLE_TO_ITEM_SPACING}"/>
        <Replacement find="TITLE_PADDING 1" replace="TITLE_PADDING ${TITLE_HEADER_PADDING}"/>
        <SourceFile name="monoThemes/ThemeMonoInverseBuilder.h" overwrite="false"/>
    </SourceFiles>

    <IncludeFiles>
        <Header name="${SRC_DIR_OFFSET}ThemeMonoInverseBuilder.h" inSource="cppSrc"/>
        <Header name="tcUnicodeHelper.h" inSource="false" priority="high" whenProperty="USE_TC_UNICODE" isValue="true" />
        <Header name="${ITEM_FONT}" inSource="font"/>
        <Header name="${TITLE_FONT}" inSource="font"/>
    </IncludeFiles>

    <GlobalVariables>
        <Variable name="${ITEM_FONT}" export="font" whenProperty="ITEM_FONT" matches="(ad[al]|tc[al]):.*" />
        <Variable name="${TITLE_FONT}" export="font" whenProperty="ITEM_FONT" matches="(ad[al]|tc[al]):.*" />
    </GlobalVariables>

    <SetupFunctions>
        <Function name="installMonoInverseTitleTheme">
            <Param value="renderer"/>
            <Param font="${ITEM_FONT}"/>
            <Param font="${TITLE_FONT}"/>
            <Param value="true"/>
            <Param name="BaseGraphicalRenderer::${TITLE_SHOW_MODE}"/>
            <Param name="${USE_TC_UNICODE}"/>
        </Function>
    </SetupFunctions>
</TcMenuPlugin>