<TcMenuPlugin name="Ethernet control of your menu using popular libraries" id="0877131c-e03e-426b-8eaf-228e01f5e7f1" subsystem="REMOTE"
              xmlns="https://www.thecoderscorner.com/libraries/tcmenuPluginItem" xmlns:xsi="http://www.w3.org/2001/XMLSchema-instance"
              xsi:schemaLocation="https://www.thecoderscorner.com/libraries/tcmenuPluginItem https://www.thecoderscorner.com/libraries/tcmenu-plugin-item.xsd">
    <SupportedPlatforms>
        <Platform>ARDUINO_UNO</Platform>
        <Platform>ARDUINO_AVR</Platform>
        <Platform>ARDUINO_32</Platform>
        <Platform>ARDUINO_ESP8266</Platform>
        <Platform>ARDUINO_ESP32</Platform>
    </SupportedPlatforms>
    <Description>Use this option to be able to control the menu over many kinds of ethernet shields and devices. The full menu structure will be available to the remote using either the protocol or the API.</Description>
    <Documentation link="https://www.thecoderscorner.com/products/arduino-libraries/tc-menu/tcmenu-plugins/ethernet-remote-plugin/"/>
    <RequiredLibraries/>
    <ImageFile>ethernet-shield.jpg</ImageFile>

    <Properties>
        <Property id="LIBRARY_TYPE" name="Ethernet library type" desc="Choose the library that supports your hardware" initial="ETHERNET_2" type="choice">
            <Choices>
                <Choice>ETHERNET_2</Choice>
                <Choice>UIP_ENC28J60</Choice>
            </Choices>
        </Property>
        <Property id="LISTEN_PORT" name="Port on which to listen" initial="3333" desc="The port on which to listen" type="int" min="0" max="65355"/>
    </Properties>

    <ApplicabilityDefs/>

    <SourceFiles>
        <Replacement find="Ethernet.h" replace="UIPEthernet.h" whenProperty="LIBRARY_TYPE" isValue="UIP_ENC28J60"/>
        <Replacement find="EthernetClient" replace="UIPClient" whenProperty="LIBRARY_TYPE" isValue="UIP_ENC28J60"/>
        <Replacement find="EthernetServer" replace="UIPServer" whenProperty="LIBRARY_TYPE" isValue="UIP_ENC28J60"/>
        <Replacement find="ETHERNET_BUFFER_SIZE 0" replace="ETHERNET_BUFFER_SIZE 64" whenProperty="LIBRARY_TYPE" isValue="ETHERNET_2"/>

        <SourceFile name="ethernetSrc/EthernetTransport.cpp"/>
        <SourceFile name="ethernetSrc/EthernetTransport.h"/>
    </SourceFiles>

    <IncludeFiles>
        <Header name="EthernetTransport.h" inSource="true"/>
        <Header name="RemoteConnector.h" inSource="false"/>
    </IncludeFiles>

    <GlobalVariables>
        <Variable name="server" type="EthernetServer" export="true">
            <Param value="${LISTEN_PORT}" default="3333" />
        </Variable>
    </GlobalVariables>

    <SetupFunctions>
        <Function name="begin" object="remoteServer">
            <Param ref="server"/>
            <Param ref="applicationInfo"/>
        </Function>
    </SetupFunctions>
</TcMenuPlugin>