<TcMenuPlugin name="Plugin designer version OK"
              id="20409bb8-b8a1-4d1d-b632-2cf9b5739888" subsystem="INPUT"
              requiresDesigner="1.3"
              xmlns="https://www.thecoderscorner.com/libraries/tcmenuPluginItem" xmlns:xsi="http://www.w3.org/2001/XMLSchema-instance"
              xsi:schemaLocation="https://www.thecoderscorner.com/libraries/tcmenuPluginItem https://www.thecoderscorner.com/libraries/tcmenu-plugin-item.xsd">

    <SupportedPlatforms>
       <Platform>ARDUINO_UNO</Platform>
       <Platform>ARDUINO_AVR</Platform>
       <Platform>ARDUINO_32</Platform>
    </SupportedPlatforms>
    <Description>Plugin is allowed because required version is met.</Description>
    <Documentation link="https://www.thecoderscorner.com/products/arduino-libraries/tc-menu/tcmenu-plugins/encoder-switches-input-plugin/"/>
    <RequiredLibraries>
        <Library>Library1</Library>
    </RequiredLibraries>
    <ImageFile>joystick.jpg</ImageFile>

    <Properties>
      <Property id="INT_PROP" name="Int Prop" initial="10" desc="int value" type="int" min="0" max="100"/>
    </Properties>
    
    <ApplicabilityDefs/>

    <SourceFiles/>

    <IncludeFiles>
        <Header name="Scramble.h" inSource="true" priority="high"/>
    </IncludeFiles>

    <GlobalVariables>
      <Variable name="allowedPluginVar" type="int" export="false" progmem="true" />
    </GlobalVariables>

    <SetupFunctions/>
</TcMenuPlugin>