<TcMenuPlugin name="%esp32.sensor.name"
              id="cc0f9246-03be-4adf-b1f5-dd501085122a" subsystem="INPUT"
              requiresDesigner="2.0"
              xmlns="https://www.thecoderscorner.com/libraries/tcmenuPluginItem" xmlns:xsi="http://www.w3.org/2001/XMLSchema-instance"
              xsi:schemaLocation="https://www.thecoderscorner.com/libraries/tcmenuPluginItem https://www.thecoderscorner.com/arduino-libraries/libraries/tcmenu-plugin-item.xsd">
    <SupportedPlatforms>
           <Platform>ARDUINO_ESP32</Platform>
    </SupportedPlatforms>
    <Description>%esp32.sensor.desc</Description>
    <Documentation link="https://www.thecoderscorner.com/products/arduino-libraries/tc-menu/tcmenu-plugins/touch-pad-sensor-plugin/"/>
    <RequiredLibraries/>
    <ImageFile>touch-pad-sensor.jpg</ImageFile>

    <Properties>
        <Property id="SWITCH_THRESHOLD" name="%esp32.sensor.threshold" initial="800" desc="%esp32.sensor.threshold.desc" type="int" min="0" max="32768"/>
        <Property id="SW_POLLING_MODE" name="%core.input.polling" initial="SWITCHES_POLL_EVERYTHING" desc="%core.input.polling.desc" type="choice">
            <Choices>
                <Choice desc="%core.input.polling.all">SWITCHES_POLL_EVERYTHING</Choice>
                <Choice desc="%core.input.polling.none">SWITCHES_NO_POLLING</Choice>
                <Choice desc="%core.input.polling.keys">SWITCHES_POLL_KEYS_ONLY</Choice>
            </Choices>
        </Property>
        <Property id="TP_HIGH_VOLTAGE" name="%esp32.sensor.high.voltage" initial="TOUCH_HVOLT_2V7" desc="%esp32.sensor.high.voltage.desc" type="choice">
            <Choices>
                <Choice>TOUCH_HVOLT_KEEP</Choice>
                <Choice>TOUCH_HVOLT_2V4</Choice>
                <Choice>TOUCH_HVOLT_2V5</Choice>
                <Choice>TOUCH_HVOLT_2V6</Choice>
                <Choice>TOUCH_HVOLT_2V7</Choice>
                <Choice>TOUCH_HVOLT_MAX</Choice>
            </Choices>
        </Property>
        <Property id="TP_LOW_VOLTAGE" name="%esp32.sensor.low.voltage" initial="TOUCH_LVOLT_0V5" desc="%esp32.sensor.low.voltage.desc" type="choice">
            <Choices>
                <Choice>TOUCH_LVOLT_KEEP</Choice>
                <Choice>TOUCH_LVOLT_0V5</Choice>
                <Choice>TOUCH_LVOLT_0V6</Choice>
                <Choice>TOUCH_LVOLT_0V7</Choice>
                <Choice>TOUCH_LVOLT_0V8</Choice>
                <Choice>TOUCH_LVOLT_MAX</Choice>
            </Choices>
        </Property>
        <Property id="TP_ATTENUATION" name="%esp32.sensor.attenuation" initial="TOUCH_HVOLT_ATTEN_1V" desc="%esp32.sensor.attenuation.desc" type="choice">
            <Choices>
                <Choice>TOUCH_HVOLT_ATTEN_KEEP</Choice>
                <Choice>TOUCH_HVOLT_ATTEN_1V5</Choice>
                <Choice>TOUCH_HVOLT_ATTEN_1V</Choice>
                <Choice>TOUCH_HVOLT_ATTEN_0V5</Choice>
                <Choice>TOUCH_HVOLT_ATTEN_0V</Choice>
                <Choice>TOUCH_HVOLT_ATTEN_MAX</Choice>
            </Choices>
        </Property>
        <Property id="TP_THRESHOLD_DETECTION" name="%esp32.sensor.threshold.mode" initial="TOUCH_TRIGGER_BELOW" desc="%esp32.sensor.threshold.mode.desc" type="choice">
            <Choices>
                <Choice desc="Triggers BELOW threshold">TOUCH_TRIGGER_BELOW</Choice>
                <Choice desc="Triggers ABOVE threshold">TOUCH_TRIGGER_ABOVE</Choice>
            </Choices>
        </Property>
        <Property id="UP_SENSOR" name="%esp32.sensor.up" initial="3" desc="%esp32.sensor.up.desc" type="pin"/>
        <Property id="DOWN_SENSOR" name="%esp32.sensor.down" initial="3" desc="%esp32.sensor.down.desc" type="pin"/>
        <Property id="BACK_SENSOR" name="%esp32.sensor.left" initial="-1" desc="%esp32.sensor.left.desc" type="pin"/>
        <Property id="NEXT_SENSOR" name="%esp32.sensor.right" initial="-1" desc="%esp32.sensor.right.desc" type="pin"/>
        <Property id="SELECT_SENSOR" name="%esp32.sensor.sel" initial="3" desc="%esp32.sensor.sel.desc" type="pin"/>
        <Property id="TS_KEY_REPEAT" name="%core.key.repeat.speed" initial="20" desc="%core.key.repeat.speed.desc"
                  type="int" min="1" max="50"/>
    </Properties>

    <ApplicabilityDefs>
        <ApplicabilityDef key="leftAndRightDefined" mode="and">
            <Applicability whenProperty="BACK_SENSOR" isNotValue="-1"/>
            <Applicability whenProperty="NEXT_SENSOR" isNotValue="-1"/>
        </ApplicabilityDef>
        <ApplicabilityDef key="leftAndRightNotDefined" mode="and">
            <Applicability whenProperty="BACK_SENSOR" isValue="-1"/>
            <Applicability whenProperty="NEXT_SENSOR" isValue="-1"/>
        </ApplicabilityDef>
    </ApplicabilityDefs>

    <SourceFiles>
    </SourceFiles>

    <IncludeFiles>
        <Header name="esp32/ESP32TouchKeysAbstraction.h" inSource="false"/>
    </IncludeFiles>

    <GlobalVariables>
        <Variable name="esp32Touch" type="ESP32TouchKeysAbstraction" export="true">
            <Param value="${SWITCH_THRESHOLD}"/>
            <Param value="${TP_HIGH_VOLTAGE}"/>
            <Param value="${TP_LOW_VOLTAGE}"/>
            <Param value="${TP_ATTENUATION}"/>
        </Variable>
    </GlobalVariables>

    <SetupFunctions>
        <Function name="setTouchTriggerMode" object="esp32Touch">
            <Param value="${TP_THRESHOLD_DETECTION}"/>
        </Function>

        <Function name="init" object="switches">
            <Param ref="esp32Touch" />
            <Param value="${SW_POLLING_MODE}" />
            <Param value="false"/>
        </Function>

        <Function name="initForUpDownOk" object="menuMgr" applicabilityRef="leftAndRightNotDefined">
            <Param ref="renderer"/>
            <Param ref="${ROOT}"/>
            <Param value="${DOWN_SENSOR}"/>
            <Param value="${UP_SENSOR}"/>
            <Param value="${SELECT_SENSOR}"/>
            <Param value="${TS_KEY_REPEAT}"/>
        </Function>

        <Function name="initFor4WayJoystick" object="menuMgr" applicabilityRef="leftAndRightDefined">
            <Param ref="renderer"/>
            <Param ref="${ROOT}"/>
            <Param value="${DOWN_SENSOR}"/>
            <Param value="${UP_SENSOR}"/>
            <Param value="${BACK_SENSOR}"/>
            <Param value="${NEXT_SENSOR}"/>
            <Param value="${SELECT_SENSOR}"/>
            <Param value="${TS_KEY_REPEAT}"/>
        </Function>

        <Function name="ensureInterruptRegistered" object="esp32Touch"/>
    </SetupFunctions>
</TcMenuPlugin>