<TcMenuPlugin name="Unit test theme plugin" id="0BB96E3C-192F-4A29-97E1-A5004E9816F7"
              subsystem="THEME" requiresDesigner="2.0"
              xmlns="https://www.thecoderscorner.com/libraries/tcmenuPluginItem" xmlns:xsi="http://www.w3.org/2001/XMLSchema-instance"
              xsi:schemaLocation="https://www.thecoderscorner.com/libraries/tcmenuPluginItem https://www.thecoderscorner.com/arduino-libraries/libraries/tcmenu-plugin-item.xsd">
    <SupportedPlatforms>
        <Platform>ARDUINO_UNO</Platform>
        <Platform>ARDUINO_AVR</Platform>
        <Platform>ARDUINO_32</Platform>
        <Platform>ARDUINO_ESP8266</Platform>
        <Platform>ARDUINO_ESP32</Platform>
        <Platform>MBED_RTOS</Platform>
    </SupportedPlatforms>
    <Description>Unit test plugin for Themes, not intended for production use.</Description>
    <Documentation link="https://www.thecoderscorner.com/products/arduino-libraries/tc-menu/rendering-with-tcmenu-LCD-TFT-OLED/"/>
    <RequiredLibraries/>
    <ImageFile>joystick.jpg</ImageFile>

    <Properties>
        <Property id="THEME_ITEM1" name="ThemeProperty1" initial="1234" desc="ThemeProperty1" type="int"/>
    </Properties>

    <ApplicabilityDefs/>

    <SourceFiles/>

    <IncludeFiles>
        <Header name="superTheme123.h" inSource="cppsrc"/>
    </IncludeFiles>

    <GlobalVariables/>

    <SetupFunctions>
        <Function name="initialiseMyTheme">
            <Param value="${THEME_ITEM_1}"/>
        </Function>
    </SetupFunctions>

</TcMenuPlugin>