<TcMenuPlugin name="Simhub serial connector" id="4123dfc3-5271-4727-81f0-1a21d06b666b" subsystem="REMOTE"
              xmlns="https://www.thecoderscorner.com/libraries/tcmenuPluginItem" xmlns:xsi="http://www.w3.org/2001/XMLSchema-instance"
              xsi:schemaLocation="https://www.thecoderscorner.com/libraries/tcmenuPluginItem https://www.thecoderscorner.com/arduino-libraries/libraries/tcmenu-plugin-item.xsd">
    <SupportedPlatforms>
        <Platform>ARDUINO_UNO</Platform>
        <Platform>ARDUINO_AVR</Platform>
        <Platform>ARDUINO_32</Platform>
        <Platform>ARDUINO_ESP8266</Platform>
        <Platform>ARDUINO_ESP32</Platform>
        <Platform>STM32DUINO</Platform>
        <Platform>MBED_RTOS</Platform>
    </SupportedPlatforms>
    <Description>Use this option to update menu items from simhub using the custom protocol. The documentation describes how to configure the protocol.</Description>
    <Documentation link="https://www.thecoderscorner.com/products/arduino-libraries/tc-menu/tcmenu-iot/simhub-connector/"/>
    <RequiredLibraries/>
    <ImageFile>simhub.jpg</ImageFile>

    <Properties>
        <Property id="SH_SERIAL_PORT" name="Serial port" desc="Enter the variable name of the serial port, E.G: Serial" initial="Serial" type="variable"/>
        <Property id="STATUS_MENUITEM" name="Connection Status menu item (-1 none)" desc="Optional BooleanMenuItem that shows connection status" initial="-1" type="BooleanMenuItem"/>
    </Properties>

    <ApplicabilityDefs/>

    <SourceFiles>
        <SourceFile name="simhub/SimhubConnector.cpp"/>
        <SourceFile name="simhub/SimhubConnector.h"/>
    </SourceFiles>

    <IncludeFiles>
        <Header name="SimhubConnector.h" inSource="true"/>
    </IncludeFiles>

    <GlobalVariables>
        <Variable  name="simhubConnection" type="SimHubRemoteConnection">
            <Param ref="${SH_SERIAL_PORT}"/>
            <Param value="${STATUS_MENUITEM}"/>
        </Variable>
    </GlobalVariables>

    <SetupFunctions>
        <Function name="addConnection" object="remoteServer">
            <Param ref="simhubConnection"/>
        </Function>
    </SetupFunctions>
</TcMenuPlugin>