<TcMenuPlugin name="Control menu with UP and DOWN buttons" id="2a3ae3ba-05f4-4c9c-aad3-3ddc88df9049" subsystem="INPUT"
              xmlns="https://www.thecoderscorner.com/libraries/tcmenuPluginItem" xmlns:xsi="http://www.w3.org/2001/XMLSchema-instance"
              xsi:schemaLocation="https://www.thecoderscorner.com/libraries/tcmenuPluginItem https://www.thecoderscorner.com/libraries/tcmenu-plugin-item.xsd">
    <SupportedPlatforms>
       <Platform>ARDUINO_UNO</Platform>
       <Platform>ARDUINO_AVR</Platform>
       <Platform>ARDUINO_32</Platform>
       <Platform>ARDUINO_ESP8266</Platform>
       <Platform>ARDUINO_ESP32</Platform>
       <Platform>MBED_RTOS</Platform>
    </SupportedPlatforms>
    <Description>Switches that represent up, down and OK controlled by switches library. These are fully debounced either pull up or pull down switches and can either be connected direct to Arduino or via an i2c expander.</Description>
    <Documentation link="https://www.thecoderscorner.com/products/arduino-libraries/tc-menu/tcmenu-plugins/encoder-switches-input-plugin/"/>
    <RequiredLibraries/>
    <ImageFile>up-down-encoder.jpg</ImageFile>

    <Properties>
        <Property id="PULLUP_LOGIC" name="PullUp Logic" initial="true" desc="Enable this to use pull up logic, otherwise pull down" type="boolean"/>
        <Property id="INTERRUPT_SWITCHES" name="Interrupt Switches" initial="false" desc="Enable this to use interrupts instead of polling for switches" type="boolean"/>
        <Property id="SWITCH_IODEVICE" name="IoAbstractionRef for Switches" initial="" desc="This allows you to provide an IoAbstractionRef if your input is on an IO expander" type="variable"/>
        <Property id="ENCODER_UP_PIN" name="Up Button Pin" initial="2" desc="The pin on which the UP button is connected" type="pin"/>
        <Property id="ENCODER_DOWN_PIN" name="Down Button Pin" initial="3" desc="The pin on which UP button is connected" type="pin"/>
        <Property id="ENCODER_OK_PIN" name="OK Button Pin" initial="8" desc="The pin on which OK is connected" type="pin"/>
    </Properties>

    <ApplicabilityDefs/>

    <SourceFiles/>

    <IncludeFiles/>

    <GlobalVariables>
        <Variable name="${SWITCH_IODEVICE}" type="IoAbstractionRef" export="only" whenProperty="SWITCH_IODEVICE" isNotValue="" />
    </GlobalVariables>

    <SetupFunctions>
        <Function name="initialiseInterrupt" object="switches" whenProperty="INTERRUPT_SWITCHES" isValue="true">
            <Param value="${SWITCH_IODEVICE}" default="internalDigitalIo()"/>
            <Param value="${PULLUP_LOGIC}"/>
        </Function>
        <Function name="initialise" object="switches" whenProperty="INTERRUPT_SWITCHES" isValue="false">
            <Param value="${SWITCH_IODEVICE}" default="internalDigitalIo()"/>
            <Param value="${PULLUP_LOGIC}"/>
        </Function>

        <Function name="initForUpDownOk" object="menuMgr">
            <Param ref="renderer"/>
            <Param ref="${ROOT}"/>
            <Param value="${ENCODER_UP_PIN}"/>
            <Param value="${ENCODER_DOWN_PIN}"/>
            <Param value="${ENCODER_OK_PIN}"/>
        </Function>
    </SetupFunctions>
</TcMenuPlugin>
