<TcMenuPlugin name="%touch.res.name"
              id="183448ac-a717-4b2b-823d-ffc7c8140ab9" subsystem="INPUT"
              requiresDesigner="2.0"
              xmlns="https://www.thecoderscorner.com/libraries/tcmenuPluginItem" xmlns:xsi="http://www.w3.org/2001/XMLSchema-instance"
              xsi:schemaLocation="https://www.thecoderscorner.com/libraries/tcmenuPluginItem https://www.thecoderscorner.com/arduino-libraries/libraries/tcmenu-plugin-item.xsd">
    <SupportedPlatforms>
        <PlatformGroup>Arduino</PlatformGroup>
        <PlatformGroup>TrueCpp</PlatformGroup>
    </SupportedPlatforms>
    <Description>%touch.res.desc</Description>
    <Documentation link="https://www.thecoderscorner.com/products/arduino-libraries/tc-menu/tcmenu-plugins/resistive-touch-screen-plugin/"/>
    <RequiredLibraries/>
    <ImageFile>resistive-touch.jpg</ImageFile>

    <Properties>
        <Property id="XPLUS_PIN" name="%touch.res.xp" initial="21" desc="%touch.res.xp.desc" type="pin"/>
        <Property id="XMINUS_PIN" name="%touch.res.xn" initial="A0" desc="%touch.res.xn.desc" type="pin"/>
        <Property id="YPLUS_PIN" name="%touch.res.yp" initial="22" desc="%touch.res.yp.desc" type="pin"/>
        <Property id="YMINUS_PIN" name="%touch.res.yn" initial="A1" desc="%touch.res.yn.desc" type="pin"/>

        <Property id="ORIENTATION_SEPARATOR" name="%core.touch.orientation" initial="" desc="%core.touch.orientation.desc" type="separator"/>
        <Property id="LIB_TOUCH_SWAP_XY" name="%core.touch.swap.xy" initial="false" desc="%core.touch.swap.xy.desc" type="boolean" />
        <Property id="LIB_TOUCH_X_INVERTED" name="%core.touch.x.inverted" initial="false" type="boolean" desc="%core.touch.x.inverted.desc"/>
        <Property id="LIB_TOUCH_Y_INVERTED" name="%core.touch.y.inverted" initial="false" type="boolean" desc="%core.touch.y.inverted.desc"/>

        <Property id="CALIB_SEPARATOR" name="%core.touch.calibration" initial="" desc="%core.touch.calibration.desc" type="separator"/>
        <Property id="TOUCH_SCREEN_CALIBRATE" name="%core.enable.touch.calib" initial="true" desc="%core.enable.touch.calib.desc" type="boolean"  />
        <Property id="TOUCH_CALIBRATION_STORAGE_LOC" name="%core.touch.calib.addr" initial="400" type="int" desc="%core.touch.calib.addr.desc"  min="4" max="65535" />
    </Properties>

    <ApplicabilityDefs/>

    <SourceFiles/>

    <IncludeFiles>
        <Header name="graphics/MenuTouchScreenEncoder.h" inSource="false" />
        <Header name="extras/DrawableTouchCalibrator.h" inSource="false" whenProperty="TOUCH_SCREEN_CALIBRATE" isValue="true"/>
    </IncludeFiles>

    <GlobalVariables>
        <Variable name="touchInterrogator" type="iotouch::ResistiveTouchInterrogator" export="true">
            <Param value="${XPLUS_PIN}"/>
            <Param value="${XMINUS_PIN}"/>
            <Param value="${YPLUS_PIN}"/>
            <Param value="${YMINUS_PIN}"/>
        </Variable>

        <Variable name="touchOrientation" type="iotouch::TouchOrientationSettings" export="false">
            <Param value="${LIB_TOUCH_SWAP_XY}"/>
            <Param value="${LIB_TOUCH_X_INVERTED}"/>
            <Param value="${LIB_TOUCH_Y_INVERTED}"/>
        </Variable>

        <Variable name="touchScreen" type="MenuTouchScreenManager" export="true">
            <Param ref="touchInterrogator"/>
            <Param ref="renderer"/>
            <Param value="touchOrientation"/>
        </Variable>

        <Variable name="touchCalibrator" type="tcextras::IoaTouchScreenCalibrator" export="true" whenProperty="TOUCH_SCREEN_CALIBRATE" isValue="true">
            <Param ref="touchScreen"/>
            <Param ref="renderer"/>
            <Param value="${TOUCH_CALIBRATION_STORAGE_LOC}"/>
        </Variable>
    </GlobalVariables>

    <SetupFunctions>
        <Function name="start" object="touchScreen"/>

        <Function name="initWithoutInput" object="menuMgr">
            <Param ref="renderer"/>
            <Param ref="${ROOT}"/>
        </Function>
    </SetupFunctions>
</TcMenuPlugin>